Category,Text
OutOfOffice,"I am on a personal leave from 23rd Nov 20 to 31st Dec 20
I will have limited access to my phone and mails.
Do drop me a Message and i would respond to it when i get access.
In case of urgency you can get in touch with my senior Harish Kale on harish@fidelis.co.in"
Deactivated,"This must be for some hospital..I want to inform you I m not working
anymore ..
So kindly contact persent purchase manager of respective hospital"
OutOfOffice,I will be out of office returning January 4.. I will have limited access to email but will strive to return your message ASAP.
OutOfOffice,"Please note that Friday, 10Apr, is a holiday in India. I will respond to your messages upon my return on Monday, 13Apr."
OutOfOffice,"Thank you for your message. I am out of the office this morning and early afternoon and checking email only intermittently. For anything urgent, please text me at 646 712 3037, otherwise I will respond later this afternoon."
Deactivated,"Sorry I've not replied sooner I'm just picking up on my E mails. Looking at
the job spec I do fit the profile it would be the location could cause a
problem as I live in Crewe Cheshire. Please don't hesitate to get back to
me if there is more to the operation or there are more variables."
OutOfOffice,"Dear all, I'm on annual leave until Monday 2nd November."
Deactivated,"Thanks a lot for reaching me out, really appreciate it. We would love to
take your help in hiring but as of now, we already have some vendors
working for us, I will surely contact you if we will have more positions
open."
Deactivated,"NO Interest, we are a trucking company, nothing to do with the price of metals"
OutOfOffice,"I am out of office, please expect delay in response to your mail."
OutOfOffice,"Thank you for your email.
I am OOF ."
Deactivated,"Should we have such requirements, our concern team will get back to you."
OutOfOffice,I am currently out of the Plant on vacation returning on 4 Jan 2021.
ConnectLater,Noted your mail. We will contact you in case of any requirement.
Deactivated,"all good here, hope you are good as well.
I have not been using my official system Email since weeks.
here, we already have existing partners working with us.
i have contact details of yours. will it you know soon after discussion
with training Deptt."
AgreedToMeet,"Thanks for your email and interest in associating with us.
Let's talk next week, Wednesday 20th Jan, in the second half."
OutOfOffice,"I will be out of the office until Sept. 10th.
I will be responding to email periodically as time permits."
AgreedToMeet,Please schedule the call tomorrow around 2.30 pm
Deactivated,sorry we are not interesstet yet.
Deactivated,"Currently we are working from home and project work is very slow and almost
in hold condition.
Right now for projects we don't have any requirement.
Furthermore we are working on our requirement."
AgreedToMeet,"Yes, I would like to receive call"
Deactivated,"Hope you are doing great.
Sorry for the late response and we would like to inform you that we have held all our recruitment processes as of now.
We shall get back to you when we resume the same."
OutOfOffice,"I am on leave from 30.10.2020. I have no access to email. For other HR
related matters, I will respond to you once I am back to work on
02.11.2020."
AgreedToMeet,Can we fix up a call tomorrow 11/08?
OutOfOffice,Thank you for your email. I will be out of office till 18-Dec. Please expect a delay in response
OutOfOffice,I will be on annual leave until Monday 2nd November.
Deactivated,"Thanks for reaching out, but I'm not looking not looking for SFMC professionals at this point."
ReferredSomeone,"Thank you for your email. Duncan Shaw no longer works for the JM Group.
Please direct your enquiry to :
Simon Girven"
ReferredSomeone,"Thank you for your email.
Please note, Roshan Puri no longer works for Calculus Capital.
If you are a company looking for strategic support and financial backing, please contact the Investment Team at investmentteam@calculuscapital.com.
For any other queries, please don't hesitate to call the office on 020 7493 4940."
OutOfOffice,I am on annual leave from 22/12 - 11/01. For urgent queries please text me 0477 011 082.
OutOfOffice,I am out of the office on vacation and will get back to you when I return.
OutOfOffice,Thank you for your email. I'm out of the office today with limited access to emaill. Shall respond as soon as possible.
SeekingMoreInfo,"I'm interested I have 6 points on my license
And what's the pay rate ?"
OutOfOffice,"Hello- I am out of the office and will respond to messages again Tuesday afternoon, December 15th. Please text if urgent."
OutOfOffice,"I am on leave . For any urgency, request you to send me an SMS or Call me."
ReferredSomeone,Please note that my official mail id has been changed to new mail id (manish.kumar3@jbmgroup.com). please<mailto:manish.kumar3@jbmgroup.com).%20%20please> use new mail id for future communication .
Deactivated,"##- Please type your reply above this line -##
Thanks for your email. The team is on the case.
FYI - we have given it a number (3365) so if either of us need to, we can refer back to this."
Deactivated,"I apologize..
Please ignore my last mail... Actually I was in touch in Symantec Suman..
If any future IT requirement, will come back to you...."
OutOfOffice,"Hi, I am on power down leave. Will resume office on 6th Jan. Please expect a delayed response."
AgreedToMeet,Please share your number so we can discuss in details.
OutOfOffice,"I'm on business travel working in European time zone, most of the day will be busy occupied with meetings, please expect delay in response to mails."
OutOfOffice,"I am currently out of the office, returning September 15th. I will have limited access to email during this time. I will check email and respond to you at my earliest convenience."
OutOfOffice,I am out of office
Deactivated,"Thanks very much for getting in touch about the role, however I'm not quiet sure if I'm the best candidate for the role, firstly due to my location - Glasgow and secondly due to lack of experience with brands like Komatsu, Volvo etc."
ConnectLater,"We will contact you, when required during oil flushing activity of our Steam/Gas Turbine."
OutOfOffice,"Now I'm on vacation, I will let you know once I returned to office.
Sorry for inconvenience in this regard."
Deactivated,"Good morning Liza , am impressed with your soft ware but right now am not
ready for it ."
OutOfOffice,"Thank you for your message, please note I am on annual leave until 14th January 2021.I will be back at work on Thursday 14th of January and will attend to your email at that time."
Deactivated,"thank you very much for your email
For the moment we are doing it internally.
I will contact you in case the situation changes."
OutOfOffice,I am currently on annual leave from 24/12/2020 and will return on 11/01/2021.
Deactivated,We will update you if there is a requirement for the sane.
Deactivated,My company is based in Baltimore and is not in need of a service such as yours.
Deactivated,Not looking at partnering with any recruitment agency at this point.
SeekingMoreInfo,How much is your fee?
AgreedToMeet,Please share your contact details so that we can call you to discuss further.
Deactivated,I'm afraid this is out of my scope as a writer/editor. But thanks for the contact.
OutOfOffice,"I am currently travelling and have limited access to email.
Please contact my secretary Ms Sreeta Gunasagaran (email: sreetag@hapseng.com ) for further assistance.
I will be back in the office on Monday 17 August."
AgreedToMeet,"Hi Amruta , sure . I am happy to have a brief call on this subject .Thanks"
Deactivated,"Hope you are doing good.
We have been working with Talent Corner for 2 months now. We were working
on an opening for a Sales Manager, we have been assigned a dedicated person
from your team. He was working very well on the opening we had but then
suddenly we stopped receiving profiles from your team and there were no
follow ups at all.
We found your team very passionate about their work and we feel they can
deliver on time. We would like to work with you and your team for sure in
the future on the opening we will have."
SeekingMoreInfo,"Hope you had a great weekend.
Can we have a quick call to discuss?
Looking forward for a response from your side."
Deactivated,"Thank you for the email. If I need assistance, I may reach out to you."
SeekingMoreInfo,Let me know.
Deactivated,"At the moment we don't required your assistant, whenever in future if we need your services our team will contact you.."
OutOfOffice,I am out of the office this afternoon with limited acces to email. I shall respond to your message when I return to work on Monday.
OutOfOffice,Thank you for your email. I am on vacation and will return to work on 4th Jan. Please expect a delay in response.
OutOfOffice,"I am on personal leave and will have limited access to email communications.
Kindly sms or call me in case of urgency and I will respond as soon as possible."
Deactivated,I will let you know if we have requirements regarding Oil Purification.
OutOfOffice,Our Kolkata office would be closed for holidays on account of Doljatra & Holi on 09th & 10th March 2020.
OutOfOffice,"Thank you for your email.
I am currently out of office on account of the festival Holi and will return March 11. Please excuse any delays in responding."
Unsubscribed,"We are currently not outsourcing our hiring requirements. I will let you know once we start.
Meanwhile, request you to unsubscribe me from your mailing list."
SeekingMoreInfo,"Kindly send on details requested on email first .
Then we can discuss further."
OutOfOffice,"Thank you for your email!
I am on leave until Dec 8, 2020, please expect a delay in my response."
Deactivated,We don't outsource our hiring.
OutOfOffice,Thank you for your message. I am out of the office celebrating the holidays with family and friends down the coast. So grateful we are able to do so & my thought are with those who cannot do the same.
OutOfOffice,Thank you for your email. I am currently out of the office with limited access to email. I'll respond to your message as soon as possible.
OutOfOffice,I am on vacation. I will return to the office 8th April 2020. In case of urgent inquiries pls approach the GLOBE project office ext -2125.
Deactivated,"Thanks for your interest in VMware.
Not sure if I responded to you earlier. We are not expanding our portfolio of recruiting partners."
SeekingMoreInfo,"Thanks for contacting venpa staffing services, please send your updated profile to jobs@venpastaffing.com. Our HR team will reach you once your profile shortlisted."
SeekingMoreInfo,"Ashwini, will you be going ahead with this?"
SeekingMoreInfo,"Since my domain is natural gas pipeline operations , hence oil purification is of not much use to me as of now.
However I will be willing to discuss about similar requirements of Natural Gas industry.
Currently we are looking for auto drainage systems in natural gas filtering."
OutOfOffice,I am currently out of the office.
Deactivated,"Knowing how hard it is to get a message out there, I do appreciate your efforts to connect, so I thought I would respond. Unfortunately, I am not the right person to connect with and not sure whom to send you too. You may be wasting your effort here. Hanks you for your interest in FootBridge, sorry I wasn't more help. Have a great weekend."
Deactivated,"thanks a lot.
Currently we have no employment plans for the Middle East."
OutOfOffice,I am currently on leave and am unavailable to respond to emails.
SeekingMoreInfo,Thank you
OutOfOffice,Im out of the office until Monday 14th December and will have limited access to email.
Deactivated,"For the moment we are not interested. As we are not using the above services for now.
But if there are future opportunities, I would direct you to the person in charge."
OutOfOffice,"Thank you for your email. Omeda's offices will be closed on Friday, May 8th for a company-wide personal wellness day. If there are any critical, operational issues that need immediate attention and cannot wait until Monday, May 11th please contact criticalsupport@omeda.com<mailto:criticalsupport@omeda.com>. Otherwise I will get back to you on Monday, May 11th. Thank you!"
SeekingMoreInfo,May I look at a sample of your latest price indexes so that I may evaluate it's usefulness for our business.
SeekingMoreInfo,"Many thanks for your email.
Our booking co-ordinators will deal with your request."
Deactivated,No interest at this time.
SeekingMoreInfo,"Do let us know if we can add some value added service from our site like campus recruitment free of cost .
You can hire the screen intern from us free of cost ."
Deactivated,"Currently am in Saudi Arabia and if I need any clarification or any queries, I approach you sure in the future.
If you are conducting any webinar or training I would like to participate in it am interested to gain some knowledge in the oil analysis field."
SeekingMoreInfo,"Market is opened.
I am giving you the clear picture.
Hope your understand well."
OutOfOffice,"I will be out of the office until Monday, September 14th. Please contact Alisa Keith for assistance. Alisa.Keith @Nucor.com"
AgreedToMeet,The timing is suitable for us. Will send you a meeting invite for the same.
OutOfOffice,am out of office ---
OutOfOffice,"I will be out of the office Tuesday, December 1 through Friday, December 4. I will respond to your email as I'm able."
OutOfOffice,"Thank you for your email. I'm currently out of order until further notice. Just kidding. I am travelling back to home. Finally. :)
And will be quarantined for the next 14 days."
OutOfOffice,"I am out of the office until Thursday, September 17th. I will respond to your email upon my return."
Deactivated,Thank you for your offer but we are fine at the moment. Thank you again
Deactivated,"Hi Richa, let me come back. Thanks for following up."
SeekingMoreInfo,I am interested for optometrist vacancy if you have vacancy for optometrist
OutOfOffice,I am out of the office until mid/late October and will likely not be able reply to any emails until my return.
OutOfOffice,I will be out of office with limited connection. I will answer as soon as I return.
OutOfOffice,"Thank you for your email.
I am currently out of the office on annual leave, returning on Monday 2nd November. Should your query be urgent, please contact my assistant Naomi Marsh on naomi.marsh@macquarie.com."
OutOfOffice,"I'm currently out of the office for the christmas holidays until the 3rd January. For urgent queries please contact marketing-uk@uk.clara.net<mailto:marketing-uk@uk.clara.net>.
Have a great Christmas and New Year, speak to you in 2020."
OutOfOffice,"I am currently on short leave with limited access to my emails.
P.S. Kindly ensure to copy me on all your mails in relation to the above."
AgreedToMeet,"Thanks for a super-fast response and connecting us to your colleagues.
Please share your direct contact details so that we can connect quickly."
Deactivated,Thank you for reaching out to us. We are all set with our developer needs.
OutOfOffice,"Thank you for your mail. I am sorry I may not be able to reply to you immediately as I may be @ work or travelling off locations.
I would go through your request and reply at the earliest."
OutOfOffice,"I Will be on personal leave today, with no access to emails and limited access to phone. If urgent, send me a text and will try to call back at the earliest."
OutOfOffice,"I'll be out of the office starting Monday, December 21st, returning Wednesday December 30th. Cushing will be closed Thursday 12/24 and Friday 12/25 in observance of the Christmas holiday.
Please reach out to my team...."
SeekingMoreInfo,Yes pls would want to understand more
Unsubscribed,Please stop sending such mails.
OutOfOffice,"I am out of the office for the U.S. Christmas holiday, returning Monday, December 28.
If you need immediate assistance during my absence, please contact Steve B. Otherwise I will respond to your emails as soon as possible upon my return. Thank you for your message."
SeekingMoreInfo,Please let me know when we can connect and take care of your health.
OutOfOffice,"I will be out of the office, returning on 11/30. I will return your message as soon as possible. Have a great day!"
OutOfOffice,"Thank you for your email.
Please be advised that I am away and will return to work on Thursday 27th August 2020."
OutOfOffice,Thank you for your email. I am out of the office Today (7/6). I will be returning to the office tomorrow.
OutOfOffice,"I will be out of the office for the holidays from Monday Dec 21'st through Friday Jan 1'st, returning on Monday Jan 4'th."
OutOfOffice,"I am out of office on PTO from Oct 19-23, 2020 with VERY limited access to email. So please expect delays in my response."
ConnectLater,Thanks for your mail. Siemens has a limited set of Vendors who we work with and our usage of Vendors for recruitment is also very low. I have anyways forwarded your mail to the Vendor management team and they can get back to you when the next empanelment window opens for evaluation.
OutOfOffice,Thank you for your email. I am on leave on Friday 6th November and I will reply to your email when I return.
Deactivated,Please note that I lift my job
ReferredSomeone,You can directly connect with HR Director Mr.Ankush
Deactivated,"I will definitely come to know with opportunity, we are individually
working for the future business . Thanks"
SeekingMoreInfo,Please send us the proposal with below reference.
Deactivated,"There is no need of oil purification and conditioning equipment in my organisation , we are OEM of material handling equipment for cement industries."
Deactivated,We are not looking out right now. Thanks
Deactivated,"Thanks for your mail. I confirm there is no hiring work, that we can give you in 2020."
OutOfOffice,Thank you for your message. I am out of the office for the holidays through January 3.
OutOfOffice,"Kindly be informed I am on leave on 7&8th December 20,
Any urgent matters, you may email me or call me directly."
Deactivated,"I would like to inform you that we are using Smartsheet for Project
Management as of now and very well satisfied with the same.
So we don't need to explore any new tools for PM."
Deactivated,"Thank you for the brochure, Scott. As I think I mentioned, my main focus at
the moment is as an independent member of an investment committee for
impact fund Blue Orchard (very small time commitment) plus a couple of
boards as a non-exec. I have little influence in recruitment, other than
the odd replacement of the CEO in companies I am on the board, but happy to
share the brochure with colleagues in case something comes up.
On the other hand, if you are in search of a non-exec for your clients, do
think of me!"
OutOfOffice,"I am out of office and will return on 14 September 2020 (Monday).
I will respond to your email when I return."
OutOfOffice,I'm currently OOO. Please anticipate delays in my email responses.
AgreedToMeet,Sure.
AgreedToMeet,"Sorry for the delayed response. Was unwell.
It was a long time ago. I'm not sure I remember very well. I think we did some Quora Question Answers for them. And maybe a few blog posts perhaps. It was a very long time ago.
Can you please share your mobile number to discuss this further?"
SeekingMoreInfo,"Send your product and service details, I will forward it to my purchase team for future enquiries"
AgreedToMeet,"Thanks for your email.
We can have Video call on Friday at 3:00PM. Please schedule accordingly
and we will meet and discuss further for engagement & improvement areas."
OutOfOffice,"Thank you for your email.
I am currently Out of Office for Business Meeting with no or limited access mails, so you can expect delay in response.
You can get in touch with the below concern for related assistance."
OutOfOffice,"I will be out on furlough from July 20th through July 24th returning July 27th.
If you need immediate assistance during my absence, please call 920-485-4463 or contact one of the individuals below. Otherwise I will respond to your emails as soon as possible upon my return on July 13th."
OutOfOffice,I will be on PTO on Sep 2nd through Sep 8th with limited access to emails.
ReferredSomeone,This mailbox is no longer active. Please direct your email to niklas.kukat@ef.com
Deactivated,"Thanks for your mail but now we don't have requirement regarding above products.
You please send your complete profile every month. We will forward it to our concern user for their information."
OutOfOffice,"I will be out of the office and unable to return emails until Monday, 9/28."
Unsubscribed,Unsubscribe
AgreedToMeet,Debrat from my team will coordinate on this. Do connect with him over mail.
OutOfOffice,"I have taken a day off on 14th September.
During this period, I will have intermittent access to emails, technology permitting, but will not be able to view attachments and response could be delayed.
You could reach out to ashok.dhawan@bofa.com in my absence"
ConnectLater,Maybe later in the week yes not over next few days
OutOfOffice,"I will be out of the office until Monday, January 4th but will be checking emails regularly. If you need to speak to someone immediately, please contact Kevin Maynard at 312.636.7819 or Kevin.Maynard@TTX.com."
OutOfOffice,"Thanks for your message. I'm out of the office for the holidays and will return on Friday, January 3. I look forward to responding to your message when I return. If you need immediate assistance please call or text my cell, 612-209-7967."
Deactivated,I do not need a payroll management at the moment as currently I have a team of payroll staff to handle it.
OutOfOffice,"Hello- I am out of the office and will respond to messages again Friday afternoon, December 18th. Please text if urgent."
Deactivated,Certainly did but I live in Scotland so assumed you had sent it to the wrong person?
Deactivated,Thanks Priyanka for your email. We will call you if we have any questions.
OutOfOffice,"I am currently on leave, returning 11 Jan. I will be back to you promptly on my return.
I hope you are enjoying time spent with loved one this festive season."
ReferredSomeone,"Thank you, for contacting FirstCom Music.
Please note that Cristy Coffey is no longer with the company. For all marketing-related inquiries, please contact Noemi Hernandez at (noemi.henandez@firstcom.com<mailto:noemi.henandez@firstcom.com>) or (972) 389-2834."
OutOfOffice,"I am out of the office today. If you need immediate assistance, please contact Justin Ellis (justin.ellis@la-z-boy.com) or Tim Maxey (tim.maxey@la-z-boy.com)."
OutOfOffice,"Thank you for your email.
I am now on annual leave until Tuesday 3rd September. Non urgent emails will be responded to on my return."
Deactivated,That's not really my area so it's not for me thanks.
OutOfOffice,"Hi, Thanks for writing in. I'm currently on business travel. There may therefore be a delay in my response to emails. Kindly send me a text msg for all urgent matters. Regards, Amar 99808 65166"
OutOfOffice,"I am currently out of the office and will be returning on Monday, 6/29/2020. I will have limited access to email and phone during this time and I will respond as quickly as possible."
Deactivated,"Sorry, I am retired, so no real need."
OutOfOffice,"I am out of the office and will be back at the desk on Mon, Jan 4.
I'll get back to you as soon as possible, latest upon my return."
OutOfOffice,"I am out of the office on annual leave from Thursday 24th December 2020 until Monday 18th January 2021.
The Finance office is closed from 24th December until 4th January."
Deactivated,"I am not in the country plz we shall talk later when I come back will
imform u"
OutOfOffice,"Thank you for your mail. I am currently out of the office.
I will be available again at 11.01.2021"
Deactivated,We are not in use of your product.
Deactivated,I am not interested at the time.
Unsubscribed,please stop sending emails. they are not relevant to me.
ConnectLater,"I am not interested in this service for now. Could you connect with me
after a month or so?"
OutOfOffice,I am away for the long weekend in other timezone & will have intermittent access to emails. Mail responses will be delayed during this course of time.
OutOfOffice,"Hello, I'm on vacation from November 2nd to November 8th back on November 9th. Please text me if you need to reach me."
AgreedToMeet,"Thanks for being persistent and reaching out to talk about your services. I
would like to speak with you. Let me know when we can talk."
Deactivated,"We have been working from home and attending to critical works only, will be able to discuss this post lockdown is lifted."
OutOfOffice,"I am currently out of the office on business travel, returning on Tuesday, January 21. I will have access to email however my response may be delayed. For anything urgent, please call/text me at 704-303-2032."
OutOfOffice,I will be out of the office with limited access to email from December 21 - January 2.
OutOfOffice,"Thank you for your email, I am currently away from office and will attend to your email when back."
OutOfOffice,"Thank you for your email.
I am out of office until Tuesday Septmeber 8th. Please contact our New Westminster office if you need asistance at 604-684-2259. Please email to BC@ablemployment.com"
SeekingMoreInfo,Please send the photos of my apartment
OutOfOffice,"I am out of the office, returning on Tuesday, 7/7. Please contact Adelina Vasiliu if you need assistance."
OutOfOffice,Thank you for your email. I am out of the business all day today and will only be checking emails periodically. If you have an urgent matter please call me on my mobile number 07778 268108 Thank you Kind regards Carmena
