Category,Text
OutOfOffice,"I am currently out of the office and will return on Thursday, July 16th. If you need immediate assistance, please contact Carol Villat at 210-369-0362 or call my cell phone, 210-385-3205, and I will get back to you as quickly as possible.
Thanks and have a great day!"
Deactivated,Hi No interest at this time
OutOfOffice,"Thank you for your email.
I am currently on maternity leave until October 2017."
AgreedToMeet,Can connect a bit later. Post 3 PM pls.
Deactivated,Thank you for your message. This is not something which can be utilised in or business due to the size and requirements.
OutOfOffice,I am out of office on vacation
OutOfOffice,Thank you for your email. I am currently out of the office and will be returning on Monday November 30th.
Deactivated,"I did contact you long back to talk about business prospects. But we got
partners onboarded in the meantime.So we will definitely keep you in mind
for future prospects."
OutOfOffice,"Thanks for your email, I am out of office today . Please expect a delayed response.."
Deactivated,Sorry Not interested.
Deactivated,No thank you. We don't use SFMC
OutOfOffice,"Thanks for your email. I am out of the office until Jan 6. Please expect my response to be delayed. If you have any urgent, please contact Kate Eighteen."
Unsubscribed,"Thanks but I don't do any recruitment.
Please remove me from your mailing list."
Unsubscribed,Not interested Richa. You can please stop messaging.
OutOfOffice,Thank you for your email. I am on PTO on 28th and 29th May. So please expect a delay in response.
Unsubscribed,"Please remove me from
Your mailing list"
Deactivated,"Thank you for your mail, As of now we don't have any open position.
We will definitely contact you whenever we have any open position."
AgreedToMeet,Great! Lets have a meeting.
Unsubscribed,I'm not interested please remove me from your list thanks
OutOfOffice,I am currently out of the office and will reply on my return.
Deactivated,"We have a rather different business model and I am not interested in your
service."
Deactivated,No please. Thanks.
ReferredSomeone,"As of December 3, 2020, I am no longer with IAC.
Please direct your questions and requests regarding N.A. Supply Chain topics to Lucian Pop.
Please direct your questions and requests regarding N.A. Logistics topics to Greg Frazier."
OutOfOffice,"I am not available from 31st Dec 2020 to 3rd Jan 2021.
I shall respond to your emails upon return."
OutOfOffice,"Hello and thanks for your email.
My working week is Mon-Thu. I'll get back to you on my return next week."
AgreedToMeet,Thanks for writing to us. We shall connect on Monday post lunch.
OutOfOffice,"I will be out of the office September 17th through the 22nd (returning on the 23rd), if you need immediate attention please contact Bill Ribolzi (bill@dicketool.com)"
OutOfOffice,"Thank you for your mail!
I am on leave from 29th Dec'20 to 8th Jan'21. I will reply to your mail on 11th Jan'21 onward."
OutOfOffice,I am out of the office until Monday 21st September. If you need me and can wait until then - speak to you soon. If you need something now - give murray.simpson@cathcartassociates.com a shout.
OutOfOffice,"Thank you for your email. I am currently out of office from Dec 23rd, with limited access to emails during this time. I will be returning to work on Jan 4, 2021, and will respond to your email at the earliest."
OutOfOffice,I am out of the office until Wednesday morning. I will review your email when I return.
OutOfOffice,"Thank you for the mail,i am out of the office with limited access to my mails, I will reply to your mail as soon as possible upon my return on 29th December."
OutOfOffice,"Thanks for your email.
I am on maternity leave from 6th July onwards."
OutOfOffice,I will be out of office untill 08/11/2020 with limited access to my e-mails.
Deactivated,"I think i have wrongly connected to you over Facebook.
I belong to construction department and we don't work for sales."
SeekingMoreInfo,"Thanks. While I have intermittent access to network till end of June, i
don't mind knowing more about your product sooner on phone. So Sanju I am
just testing your product here.. good luck to your team."
Deactivated,"I am currently not looking for any vendor empanelment.
I will connect with you if I will be in need. Thanks"
Deactivated,"I have resisted responding your earlier similar mails .
We are not Americans and please know that a customer must be addressed as Sir / Madam and you can't get too familiar by adressing by family name . Thank God that you did not know my first name as mail would have been then addresssed more informally"
Deactivated,"Many thanks for your email and suggestions, which are available in the case of repairs and maintenance in the oil and gas industry. We will be ingormed if need your services."
OutOfOffice,"Thank you for your email. I'm taking some time off of work to be with family this holiday season. I'll return to work on January 6 - if you need to reach me before then, the best bet is a text to my cell at (206) 214-6678."
Deactivated,Sorry but I'm happy with my job.
Deactivated,No interest my side thanks very much.
Deactivated,I have already included your name in vendor list in procurement of oil purification unit.Enquiry will be sent you also when procurement will be in tendering stage.
SeekingMoreInfo,What is the recipient's name that you are trying to reach?
SeekingMoreInfo,"My Name is Gregg Carpenter I am the CEO of Carpenter Metal Solutions with Locations in Ohio, Alabama, and Texas.  I received the below from a email you sent to my VP PGM.  I would like to see what your product is and investigate how it compares with other resources."
ReferredSomeone,I'm sharing this email with my colleague Mr.Suvam Ghosh to take the discussion forward.
OutOfOffice,"Thanks for your mail ,I am on Leave 8th Dec'20 to 11th Dec '20 and I am not
able to access Mailbox for anything urgent please contact to
Email Id- ravindrat@ecomexpress.in <mailto:ravindrat@ecomexpress.in>
Other Point of Contact Mandeep- mandeep.p@ecomexpress.in
<mailto:mandeep.p@ecomexpress.in>"
OutOfOffice,I will be traveling today and will have limited availability to email and cell service.
Unsubscribed,No and plz remove me from your list.
Deactivated,No thanks
ReferredSomeone,"My Email ID has been changed to shyam@claris.in. Kindly update it in your contacts, and let us be in touch with shyam@claris.in."
Deactivated,"We already have a payroll provider that we are using and are very happy
with."
Deactivated,We are not interested.
OutOfOffice,"I am on vacation today with no email access.  As scuh, my responce will be delayed.  If you have an urgret need.  Pleaese call my cell at 301.885.7293 or email Rashida.Williams@ablinc.com."
OutOfOffice,"I will be out of the office September 7, 2020 through September 11, 2020.  I will return to work on Monday September 14, 2020.  If you need immediate assistance, please contact Karen Coon at kcoon@precisionsteelmfg.com."
SeekingMoreInfo,I HAVE RECEIVED YOUR MAIL. PLZ GUID ME FOR NEXT STEP
AgreedToMeet,"Thanks for your call.
I am looping our Business Development Head - Anish Alurkar (M) 93730 35050
to discuss with you on this."
Deactivated,Please stop sending these mails. Not interested.
OutOfOffice,"Thank you for your message.
The office in India is closed due to Diwali festival, will  have no access to emails till 30 Oct 2019, hence reply might be delayed.
For any immediate / urgent requirement you can sms me on +91 9833628074."
SeekingMoreInfo,How did you get my email?
Deactivated,FYI i havn't company just Im commissioning engineer in Hyundai engineering
SeekingMoreInfo,"Thanks for your email.
We would be interested in Oil Purification & Conditioning products and also into the Lube Analysis Equipment's.
Please share the details, operating process and cost of it.
We would be able to reply you promptly after 1st June as at present we are in lockdown position due to Corona pandemic and EID holidays.
Awaiting your reply,"
Deactivated,"Thanks for reaching out. At the moment we are not considering a change in
our payroll provider as well as our HR systems. Will keep you in our
database should the need arise. Thanks!"
AgreedToMeet,"Greetings from Puratech Solutions (India) Pvt Ltd!!!
Attached is the JD for the profile of BA, we are looking for. Kindly get me connected with the recruiter if any further understanding needed.
My number would be +91-9594617186"
ReferredSomeone,"Richard Ragan has retired, but occasionally comes in the office to assist. Make sure you copy JEFF@STEELERECTORSINC.COM on any messages to Richard.
For assistance please contact:
David Clifton
O: 912-544-1380 x104
david@steelerectorsinc.com"
OutOfOffice,"India office is closed on Fri, 30/Oct. Response will be delayed. Call me or text/sms me in case of need."
Deactivated,You have reached a mailbox that is no longer in use with Stanford Health Care.
AgreedToMeet,"I would like to know more about your products and services. We can talk on
4th Dec on it."
OutOfOffice,"Thanks for your email.
I'm on annual leave, returning Monday 4th January.
If you need something urgent, please call or message me on +61 403 242 201.
Otherwise, I'll reply when I return."
Unsubscribed,"I did not put in any request for AI Sales Assistant.
It is highly unprofessional to nick somebody's email id from LinkedIn and start sharing presentations and treating them like sales leads.
Please take me off of your emailing list."
AgreedToMeet,I am calling you shortly.
Deactivated,"I no longer work at Urban Utilties, please contact Geoff Collins if you have queries related to the Digital Enablement team."
Deactivated,"Many thanks for your e-mail.
Currently, our plant lubrication and condition monitoring requirements are managed through experts from Castrol. We will come back to you, in case requirement will arise."
Deactivated,We will get back to you once our requirement arises.
Deactivated,"Sorry for late response.
As a matter of fact, we are not currently active in this field of activities and we have no projects in hand or ahead us. Yet, I would be thankful if I could have your technical and financial data in case a relevant subject comes up."
Unsubscribed,DON'T SPAM MY EMAIL. I AM NOT INTERESTED.
ReferredSomeone,"As of September 17, 2018, I am no longer working at Kansas City Southern Railroad. If you are need of assistance, please contact KCS customer solutions at csolutions@kcsouthern.com or Jennifer Fussell at jfussell@kcsouthern.com"
AgreedToMeet,I may be contacted on 9937063517.
Deactivated,"Thank you Rachel
I forwarding you offering to others
I don't know anyone who trades scrape
And I think you Have me confused
If it is not too much bother please stop sending this to me
Were here to help you save money and improve margin with our industry leading price data."
OutOfOffice,"I am out of the office on vacation returning Tuesday July 14th, during this time  My Backup is Albert Poole, Albert can be reached at apoole@cds.net."
OutOfOffice,thank you very much for your email. We are on national holiday on 11th of January and I will come back on 12th of January.  Sorry for your inconvenience caused by this. Many thanks for your kind understanding.
OutOfOffice,"Thank you for your email.
I am unfortunately out of the office unwell at the moment. My access to emails will be very limited and sporadic.
I will respond to your enquiry upon my return.
If the matter is urgent, please contact my colleague David at david.bloxham@softwareone.com"
AgreedToMeet,WhatsApp me +91 9874368836
Deactivated,"We don't have any opening as of now, will get back to you once we have opening in my company."
Deactivated,"Thanks for your mail.
We don't have any activities lined up for oil purification and conditioning in my current project.
As and when there is a requirement for this, I will contact you."
AgreedToMeet,"We're not dealing in Lubrication Reliability and Contamination Control.
Here, we're operating a cryogenic plant i.e, Air Separation Unit in which
we have 6 big centrifugal compressors and 3 reciprocating compressors.
As you mentioned in the trailing mail that you are also serving at JSW.
So, if you visit here at JSW Vijaynagar anytime we can meet up and we can
arrange a visit to our plant also."
OutOfOffice,"Hi, Thank you for your email.I am on leave  today and have limited access to emails. Will revert to you on your emails once I resume office."
SeekingMoreInfo,Thanks for getting back to me
OutOfOffice,"Hi, I am travelling on personal emergency. Please expect a delay in my response. In case of any urgency, please call me on my mobile."
OutOfOffice,Kindly note that I shall be on leave from tomorrow but most of the time reachable on phone.
ReferredSomeone,You may get in touch with Mr. Antony @ antonyrc@fss.co.in<mailto:antonyrc@fss.co.in> who heads the Recruitment Function at FSS.
AgreedToMeet,"Please let us talk tomorrow 12/03/2020, at 10:00 am Muscat ( Oman ) timing.
My contact   +968 9817 3607"
ReferredSomeone,"My email has changed from Michaela@conceptframes.com to michaela.gibbs@assaabloy.com.
Please use this new email for all future communications."
Unsubscribed,Unsubscribe
OutOfOffice,Our Facility is close in observance of the Thanksgiving. We will return on Monday 11/30/20.
OutOfOffice,"Thank you for your email. I will be out of the office on vacation until 8/19.  During this time I will have limited access to email  and my response time will be significantly delayed. If this matter is urgent, please contact Daniel Conner at 864-213-5380."
Deactivated,My contract runs through to April 2021  so not looking at the moment.
Unsubscribed,"Please note that this email is no longer being monitored. Please remove this email from your distribution list.
Feel free to call our Main office with any questions at 714-572-8881"
ReferredSomeone,"Our HR team in Pune takes care of hiring services, and you can get in touch with manik.khatavkar@mastercard.com<mailto:manik.khatavkar@mastercard.com>"
OutOfOffice,"Thank you for your email. I'm out on leave and will be back on Monday 11th January 2021. If you matter is urgent, please call or text me on 027-808 1913. Otherwise I will respond to your email on my return."
OutOfOffice,"Thank you for reaching out, I am out of office between 26/11/2020 - 9/12/2020 with limited access to mails. kindly reach out to Praveen( Co-Founder, Multi Recruit) at Praveen@multirecruit.com or Champa (Delivery Manager ) at champa@multirecruit.com"
Deactivated,"Thank you for your email. We have recently implemented various tools for lead gen so this is not something of interest currently.
I will keep your details on file should we require your assistance in the future."
OutOfOffice,"Thanks for writing. It's a Public Holiday and I am OOO, please expect a delayed revert."
SeekingMoreInfo,"Can I have your pricing structure/ level?
And is it only for payroll? How about the recruitment?"
OutOfOffice,"I am currently out of the office with no access to emails.
I can be reached by cell phone at 678 725 0036"
Deactivated,Thanks for your note but we do not need this service.
OutOfOffice,I'm currently out of the office with limited access to e-mail.
Deactivated,"Thank you for reaching out to me. Our payroll is outsourced and we're not
looking at subscribing for any system at this time.
However, I will keep note of your email and services for future reference."
OutOfOffice,"Please note that I am OOO Monday 12/23 through Monday 12/30 on vacation for the Christmas Holiday.  I will be returning on Tues. 12/31.  Response times may be delayed.
Thank you for your understanding and happy holiday's,"
AgreedToMeet,Please reach out to me at 11:00 AM today.
AgreedToMeet,"Please call me on Thursday @ 9654900566 (preferably second half). We can discuss over phone and if further needed, we will schedule a F2F meeting as well."
Deactivated,"Thanks for reaching out Victoria. Now's really not the right time for us, but I'll be in touch if we need some support in the coming months."
SeekingMoreInfo,can you understand this solution and how this can help us in our environment
Deactivated,I will connect with you once I require your services. Thanks
Deactivated,"Could not reply you being busy in family issues at native place.
kindly do not consider me in your prospective leads, as presently i don't know how early i will be replying it.
one more reason I am bit susceptible in this opportunity, as I have been heavily lost by 'franchise' model in education business and also HR activities don't impress me as far as good earnings are concerned. as
however, you can share the regular business info/ posts if you wish."
Deactivated,"I have received your previous emails, and as you can see from the attachment, I have also responded to you.
I appreciate you're looking for forge new collaborations, but as already mentioned in my previous email, I don't have any plans (or budget for that matter) to engage new partners and our planning for the year is set."
OutOfOffice,"Thank you for your message.
I will be out of office on 10th March 2020 due to holiday in Bangalore, during this time I will not have access to E-mail. I will respond to your messages once I am back to office on 11th March 2020."
Deactivated,"All set, I have received all these, been tied up, but no questions at this time.   Thank you."
OutOfOffice,"Please note that I am out of the office from 28/09/2020 and back on board from 13/10/2019. If the matter is urgent please contact one of the relevant teams below or Account Executive Louis Sassine (m: 0435 412 438 e: sassinelo@stgeorge.com.au<mailto:sassinelo@stgeorge.com.au> )
Business Banking Support: 133 800
Business Servicing: 1300 655 435
Report a Lost or Stolen Cards in Australia: 1800 028 208
Report a Lost or Stolen Cards from outside Australia: +61 2 9553 5333
STG Internet & Phone Banking Helpdesk: 1300 555 203
BBO Help Desk: 1300 554 004
Payway Support: 1300 395 501
Merchant Enquiries: 1300 650 977
Quick Super: 1300 395 654
International Trade 1300 550 241"
Unsubscribed,"Where did you get my personal email address from?
Do not send me anymore emails on this."
SeekingMoreInfo,"OK Sir,
Please Include me also."
OutOfOffice,"Thank you for your mail. I will be on leave from 9th-11th November & 13th - 16th November
I will resume work on 17th November and respond to mails thereafter.
For anything urgent please feel free to call."
ReferredSomeone,Pl approch direct at Mr Singhal ID
OutOfOffice,"I am back in the office on October 27, 2020. In case of an urgency please contact:
Sven Aschhoff - Tel. +49 (0) 221 4984-132 / sven.aschhoff@steinert.de"
AgreedToMeet,"Thanks for your email
Can I call you tomorrow?
My phone no is 9976488000"
SeekingMoreInfo,"It was a wonderful session and an awesome product. which would bring a
value addition to a start up company like us.
We will certainly revert back positively after discussing with my
co-founder and team."
ReferredSomeone,"Sorry Mam, For not replying you .
But mam I already provided you the contact detail of my HOD and it would
better that you contact him for any business work..because here,we are not
authorized or deal in such type of relevant matter.
So, requested you to please contact him.
I think you understand me."
Unsubscribed,"I am not interested.
please remove my name from your list."
SeekingMoreInfo,"I work with Sriramulu in capacity of Head HR
You can henceforth write to me"
OutOfOffice,"Thank you for your email, I apologize that I am not available to answer it immediately. Unfortunately I am out of office the remainder of this week. If the issue is urgent or relates to an employee injury, please call my cell. For Issues concerning the McPherson Office please reach out to Taylor at (620) 504-6520 or mcpherson@lsistaffing.com For Issues concerning the Newton Office please reach out to Paola Chacon at (316)804-7200 or pchacon@lsistaffing.com For Issues regarding the Wichita Office please reach out to Diana Amezquita at (316)771-3729 or damezquita@lsistaffing.com All other non-urgent matters will be handled upon my return. Thank you for your patience, I apologize for any inconvenience"
OutOfOffice,"I am out of the office until Monday, 1/4 with access to my email. If anything urgent comes up, I will do my best to respond. "
ReferredSomeone,"Hi, change is occurring at OXFAM! Please contact Khoi for any technology related query or message me via mobile."
SeekingMoreInfo,"I'm doing very well, thank you very much. I hope so are you.
I' pleased to hear from you, your message got me interested. I believe by qualification I would be a great fit for the role.
However, I am quite content with my current position and I thought I would push my career more towards sales in the future.
What I want to say is it would need a really great employer with strong core values, an amazing working environment and a compensation above average to convince me otherwise.
If you believe your client can't provide that I'd be happy to have a conversation about it."
AgreedToMeet,Please give me a call today.
Deactivated,"Thank you for your email.Now we don't need any help by you.If i need i will
contact you.
Thanks for your interest."
SeekingMoreInfo,"Please forward your payment terms so that we will acknowledge and share the
job descriptions."
OutOfOffice,"Thank you for your email, I am currently on leave until Jaunuary 10th
For all urgent account enquiries or bin services please contact our office on 13 73 29
alternatively i will respond to your email on my return."
SeekingMoreInfo,Pl send details.
Deactivated,Thanks for reaching us . Presently we are not looking for any hiring services . Will confirm in case any need in future
OutOfOffice,"Thank you for your email.
I am currently out of the office and returning on Monday 4 January 2021.
If your matter is urgent please contact me on 0406 985 477, alternatively I will respond to your email on my return."
ReferredSomeone,"Thank you for your email. I am no longer working for Red Cross. It has been a privilege to be a part of this Humanitarian Organisation and lead the IT team. While the recruitment of the future CIO is undertaken, please direct all queries to Danijel Andric dandric@redcross.org.au<mailto:dandric@redcross.org.au>  or Leanne Smithson lsmithson@redcross.org.au<mailto:lsmithson@redcross.org.au>."
OutOfOffice,"Thank you for your email.
I am on vacation and will be back in the office on October 9th. Your e-mail will not be forwarded. In urgent cases please contact Clemens Drechsler: Clemens.Drechsler@philips.com<mailto:Clemens.Drechsler@philips.com>."
Deactivated,"Hope you are well.
As I have not responded to your emails, I would assume you would have taken a hint. We are not interested I'm afraid, so thanks but no thanks."
Deactivated,Thank you for your message.  You have reached an e-mail address that is no longer active. Frank Morton will have access to this email box and will respond as needed
Deactivated,"Thanks for your email.
As of Friday 11th September I have left ServiceNow and am enjoying some time off before my next challenge.
Please direct your query to Ramesh Talagampa at: ramesh.talagampa@servicenow.com Thank you, Usha."
AgreedToMeet,Can we align this today in second half?
OutOfOffice,"I am currently on leave until 31 December 2020 I will not be accessing emails during this time.
For process enquiries you can contact gavin.coates@woodplc.com or steven.bartynek@woodplc.om.
For business development please contact lee.taylor1@woodplc.com"
OutOfOffice,"I am away on leave until 11 January but will respond on my return
Merry Xmas!"
Deactivated,Thank you for reaching out.  We are not interested in your services as this time.
Deactivated,"Thank you very much for your email,
For the moment we won't be interested in such services.
We will contact you if the situation changes
I wish you a pleasant day"
SeekingMoreInfo,"As iam interested to know about it in detail.. Kindly send me your
contact details so that I can have clear knowing of what its is all about."
OutOfOffice,"I am currently out of the office and will have very limited access to e-mail, if your matter is urgent pleace contact my administrator Renee Grabia at rgrabia@auriniapharma.com.  I will be returning to the office by July 27th."
SeekingMoreInfo,"discussions do not harm, so let me know further"
AgreedToMeet,We can connect sometime on Friday @ around 11 AM.
OutOfOffice,"I am on leave from 16.09.2020 to 22.09.2020. I will resume to work on 23.09.2020. Please liaise with Ms Lai Li Mei for urgent matters, Ms Wong Lai Leng for Non Motor matters and Yong Faridah for Agency matters at 05-2554097."
SeekingMoreInfo,"Yes, I am interested
please use my Professional adress
Francois.theoret@arcelormittal.com"
Deactivated,"We are in a severe cash flow crisis due to poor business volumes.
Currently, we are not looking for any new ventures. However, once the need arises, we will come back.
In the meantime, you can send us your technical credentials."
OutOfOffice,"Thank you for your email.
I'm currently in a training session. I will be back online at midday."
Unsubscribed,Not interested. Pls unsubscribe me
OutOfOffice,"I am out of office, return on Tuesday  22 Dec.
I will respond your email on my return, but if it is really pressing please call me on 0412 213 697."
OutOfOffice,I am currently traveling out of the office with limited access to email. Following my return on Sep 14th I willl reply to your message.
Deactivated,No thanks for now.
OutOfOffice,"I will be out of office and will return on 28 September 2020. For urgent matters, kindly contact me on my mobile or my team."
OutOfOffice,"I'm on leave on 6th & 7th Aug followed by the weekend.
Please text / call me on 8411817979 for any urgent matters.
Please refer to the HRSD chat if you have any general questions ."
