Category,Text
OutOfOffice,I'm out of the office; if you need assistance please reach out to Monica or Kayli - thanks!!
SeekingMoreInfo,What kind of business will this product be useful for ?
AgreedToMeet,let connect today at 2.00 pm.
SeekingMoreInfo,"Currently we already have a payroll system. But we don't mind to know more
about your system. Please share the information with us via email and we'll
study about it.
We are WFH at this moment. I'd like to suggest you to do any
communication via email instead of a phone call."
SeekingMoreInfo,"My name is Dimple, - would like to know more"
OutOfOffice,I'm currently on annual leave and will be returning on 6th Jan.
OutOfOffice,"OUT OF OFFICE NOTICE
Thank you for your message. I am away from the office on returning Monday, August 31st. Please excuse delays in replying to an email, I will reply to your message as soon as I can."
AgreedToMeet,Can you please send us your availability for a quick demo to Ravi Nimmagadda.
AgreedToMeet,Could I interest you in a call to learn more about Oil Purification and Conditioning?
OutOfOffice,Please note I am on Diwali vacation from 11th to 16th Nov with no access to mails. Please expect delay in response.
ReferredSomeone,"Please get in touch with our Maintenance Head Mr D Bhattacharjee,"
AgreedToMeet,"Hope you are well! Could we get a quick call sometime today to fully
understand your services? Do let me know a good time."
AgreedToMeet,I would really like to learn more about FarmERP. How about we connect tomorrow 10am UAE for an introductory call? Let me know if that works or else we can schedule for another time.
OutOfOffice,I'll be out of the office on vacation untill september 22th.
OutOfOffice,I am out of office on 05.06.2020
SeekingMoreInfo,"This is Ashwini from MagikMinds, I will be looking the recruitments.
Please reach me to discuss further."
Deactivated,Presently there is no requirement as such.
OutOfOffice,Thank you for contacting me.  I am currently out of the office returning Monday 6/22.  I will have access to email while I am out and will get back to you as soon as possible.
Deactivated,"Apart from the job being too far away I don't have any experience of
hydraulics. I'm more electrical biased than mechanical."
Unsubscribed,"Thanks for thinking of us, but this is not on our radar.
Can you please take me off your list?"
Deactivated,Not Interested.
OutOfOffice,Hello- I am out of the office with no access to phone or email.
Deactivated,At present we are not looking for ERP.
Unsubscribed,Please delete me from your list
OutOfOffice,"I am on Leave, returning Monday 11th January, 2021."
OutOfOffice,I will be out of the office 09/05 and returning 09/14/20.
OutOfOffice,"I am currently on vacation.  I am checking email, but my response will be delayed.
If you need to reach me, please contact my cell phone at +65 8909 4389.  I will be back in the office January 4."
Deactivated,"I am not sure why I have received this email, we have hired a CRM manager who is skilled in marketing cloud a couple of months ago."
Deactivated,"No, thankyou"
OutOfOffice,I will be out of the office until Monday November 2nd
Deactivated,We do not trade any scrap metal
OutOfOffice,I am currently only working Tuesdays and Thursdays and will respond to all emails as soon as I can.
AgreedToMeet,please find my contact details below in my signature.
ReferredSomeone,I have marked this mail to my colleague Pavan Pal who drives our digital initiatives. He will get in touch with you to commence the evaluation process.
Deactivated,"Thank you very much about your email and information on the email and your company.
As You know I can't connect together because of sanctions"
OutOfOffice,Please note that our marketing team cannot be reached from 23rd of December 2019 to 6th of January 2020.
SeekingMoreInfo,Sounds good
OutOfOffice,I am currently out of the office with no access to my emails. I will return to the office on 04.01.2021 Your email hasn't been forwarded.
Deactivated,"We are still interested at the programm.
But at the moment we do not have the time to work on the project.
But I will tell you, as soon as we have some more time for it."
Deactivated,"Please be advised, I have not replied to your email as it was addressed to. Please take note from my email address that I am clearly not this raises concerns over the accuracy of your data."
AgreedToMeet,Ok please communicate
SeekingMoreInfo,Which property you are referring to . Which city are you from ?
ReferredSomeone,Your emails are coming through to our head office generic email address.  If you wish to direct your emails directly to Gavin please contact him directly and ensure he wishes to receive so many emails from you.
SeekingMoreInfo,"Gareth has forwarded me your email regarding recruitment.
I look after recruitment for the company - we're currently working to 10% of basic salary, 45 days payment terms and 12 weeks full rebate with our current agencies. Is this something you can work to?"
Deactivated,No thank you.
Deactivated,No
AgreedToMeet,"our interest is mainly focused on handling our farmers remotely and
register every step and every application of fertilizers or
pesticides through the growing and prior to harvesting process.
we can talk further through skype or by phone"
Deactivated,We have no needs going forward as we recently field chapter 11 and are within a few weeks of folding the company.
SeekingMoreInfo,I will forward your request to our recruitment team. They will get in touch with you.
SeekingMoreInfo,We'd welcome the opportunity to see the CV so we can identify some options.
OutOfOffice,I am in interivews all day on Monday 23 November 2020 with limited or no access to emails.  I am then on annual leave from Tuesday 24 November 2020 to Monday 30 November 2020 (inclusive).  I will return to work on Tuesday 01 December 2020.
AgreedToMeet,Can we plan the call next week.
OutOfOffice,"I'm currently out of the office until Monday, 4th May"
OutOfOffice,I'm sorry to have missed you. I'm out of the office for a few days with limited email access. I'll reply upon my return. Thank you.
OutOfOffice,Now I am on leave.After join on duty I will confirm you.
Unsubscribed,"Please do not send me any more mails, we are not interested."
OutOfOffice,"I am currently working from home around the kids (as i'm sure many of you are), so I will get back to you as soon as possible."
OutOfOffice,"I am currently out of the office and will be back on Tuesday, October 13th. For urgent issues, please contact eClinical Solutions helpdesk."
AgreedToMeet,You may call.
Deactivated,We already using the oil filtration and it is not having any issues so we would like to continue with it.
Deactivated,Not interested.
Unsubscribed,Please stop sending me such emails.
AgreedToMeet,"I was under the impression that you will discuss with management and then take a call.
Yes, let me call you at 3 pm today."
AgreedToMeet,happy to set-up a call to discuss further.
OutOfOffice,I'm on annual leave until 11 Jan. Please call or message me for anything urgent.
ReferredSomeone,Foram will take this further.
Deactivated,"Thanks Adam, but nothing which would be appropriate in our business currently"
Deactivated,We will not be interested at the moment.
Unsubscribed,Please remove our address as we do not trade or buy or sell scrap.
Deactivated,"Currently we do not have any requirement
Thanks for the mail, we will get in touch if any such requirement arises"
AgreedToMeet,"Yes I was interested in property management back in 2017 but because no one
from your company responded then I switched to another company but I am
still interested what unique service you can offer.
Sure you may call"
Deactivated,"But due to Coronavirus pandemics, complete unit is Under shutdown. I will contact you whenever your service is needed in future."
Deactivated,"currently, we are not looking for any
services.
I will surely get in touch with you in the future if we are looking for any
services"
Deactivated,You will always be our first preference for future hirings.
OutOfOffice,"Season's Greetings!  I am currently out of the office and will be returning Friday, December 27."
OutOfOffice,"Beginning Wednesday, 11/3 through Friday 11/13, I will be out of the office on vacation with no access to voicemail nor email.  I will return all calls and emails upon arriving back in the office on Monday, 11/16."
OutOfOffice,"Hi, I am in an all day meeting, apologies for any delay in replying to you."
OutOfOffice,"I am out of the office on vacation..  I will be checking e-mail periodically throughout the day.  Please contact Alex Linsner, linsna@ilcdover.com, if you need to reach someone right away"
SeekingMoreInfo,"I have already replied you on 30.10.19.
Since I am not in HR team & thereby the below request is not valid.
Additionally, I am looking for a change now."
OutOfOffice,"I'm currently out of the office, I'll respond to your query upon my return on 9 December 2020."
Deactivated,"Apologies on the late reply.Thanking for the email and at this moment we
are not keen to have this system.Will let you know in  future if we plan to
use it"
Deactivated,"As of today, I am no longer working for Stokota.
Your emails will not be forwarded."
Unsubscribed,Pls dnt sent me mail again n again as i said you i dnt have any any
AgreedToMeet,Send resume and I will have a 15 minute meeting . Thank you
OutOfOffice,"I will be on leave today with limited access to mails, please expect a delay in responses."
Deactivated,"sorry for the late answer, I didn't checked this mail in the last week due to Christmas time.
Thanks a lot for the offer, but unfortunately I am not interested on change my job."
Deactivated,"I would like to inform you that we don't intend to renew the contract this
year.
Hence would suggest you to stop the reminder mails which we keep getting
from signeasy on your company behalf.
We don't have any hiring plans in the coming months. In case we have any
will get in touch with you. But at present i don't want to sign any
contract unnecessarily."
Deactivated,"We're not interested, Sonia."
OutOfOffice,"I'm currently out of the office, returning Monday, Nov 30."
OutOfOffice,I will be out of the office until Monday Nov 4th.  I will respond to all emails upon my return.
SeekingMoreInfo,"I have shared this with my digital team and am waiting to hear back from
them. It'll be a while though. Thanks."
ConnectLater,"Sorry, at this juncture. May be after 6 months."
SeekingMoreInfo,I'm currently looking for a Chinese resource. Can you help me with that.
Deactivated,We'd just like to let you know that we have received your help request and are working on it.
Deactivated,"Thanks for reaching out, no questions at this time and not interested to review."
SeekingMoreInfo,can you provide me the NTPC vendor code if you have and any purchase order from NTPC ??
Deactivated,Working for the energy services we do not sell any hardware to any client. Nor do we buy any. We only cell engineering services. I do not believe that we can ad any value to your business model.
OutOfOffice,I will be away from the office until August 6.
OutOfOffice,"Please be advised that I will be on sabbatical for the remainder of the year. In my absence, the rest of our team will be happy to assist you."
OutOfOffice,I am currently out of office on annual leave until 24th September with only intermittent access to my emails.
OutOfOffice,"I am currently out of the office on PTO returning Monday, January 4th."
AgreedToMeet,"Sure, Shall get back to you shortly, we were bit occupied with other assignments."
ReferredSomeone,"Wish to inform you that we have Corporate Recruitment Cell who generally dealing with Sourcing Agencies for empanelment, hence you may get in touch with Ms. Rachna Bhuse on 022-67961425 or can email her on rachna@godrej.com<mailto:rachna@godrej.com>."
SeekingMoreInfo,"Sorry for the inconvenience , but now a days I am
still not active for the work and I even though not discuss my point yet
with my superior once I will contact him I will revert you. For the mean
while hold for the discussion."
OutOfOffice,"I am currently out of the office on leave.
I will be returning on Tuesday, 24 November."
Unsubscribed,Please remove me from your mailing list.
OutOfOffice,"I will be on vacation from 9/12/20 - 9-20-20, returning to the office on 9/21/20. If you need assistance during this time, please contact parts@companywrench.com or call 740-654-5304."
AgreedToMeet,Let's schedule a call this weekend.
OutOfOffice,"I am currently out of office until Tuesday, November 12th.
I'll respond to your message when I return."
OutOfOffice,I am out of the office until July 6th. I will respond to your inquiry after I am back in the office.
SeekingMoreInfo,"Did you provide the overview deck and pricing structure to me? If not, please (re) send."
Deactivated,Not interested...
OutOfOffice,I will be out of office from 18th Dec-27th Dec and will not have access to emails and calls. I will do my best to respond promptly to your email when I return on 28th December.
OutOfOffice,I'm currently out of the office.
OutOfOffice,"I am currently out of the office, returning on Thursday."
OutOfOffice,I am currently on vacation and will have limited access to my email. Please give me a call or send me a text if urgent.
OutOfOffice,I am currently out of the office until Monday Dec 2nd. If this is an emergency please  call  2222 for or leave a message and I will respond at my earliest opportunity.
ReferredSomeone,"Thank you for your enquiry, which has been passed to the relevant individual or team.
We will aim to respond to you as soon as possible."
SeekingMoreInfo,What would the appropriate month to reconnect with you.
OutOfOffice,I will be out of the office September 11th. If you need immediate assistance please call Luis Mendoza at 979-865-9137.
Deactivated,This event has been canceled.
OutOfOffice,I am on leave - Emails will be responded with delay. Will be back in office on 29th June 2020
OutOfOffice,"I am currently out of office, on annual leave, with no access to email, until Friday 11th December. I will respond as soon as I am able."
OutOfOffice,I am currently out of office. Please expect delayed response
Deactivated,"Not interested, thank you."
SeekingMoreInfo,"You can always write to me, both way communication always pay. Will walk
through the video once am free.
Will get back to you if I have any query."
OutOfOffice,I am out of office the rest of the day and will be reading emails tonight
Deactivated,I'm not in a department where I could suggest for your products.
AgreedToMeet,Let us connect today / tomorrow as may be convenient for you to discuss the next steps.
OutOfOffice,"I will be out of the office Monday, August 10th - Friday, August 14th. During this period I will have limited access to email.
For immediate assistance please contact Cally Melton at 804-282-1289 x 2 or cally@prospectblue.com."
OutOfOffice,I am out of the office until Sep/20th/2020.
Deactivated,"Thank you for sending us your resume. Executrade - Your Recruitment Specialists, is celebrating 40 years as Western Canada's leading full service recruitment firm, and we owe our long standing success to you - the candidate!
We receive a high volume of resumes weekly, and are doing our very best to respond in a timely manner. Your rresume will be carefully reviewed and if your experience and skills match the requirements of any of our current job opportunities, we will contact you. If there are no immediate fits, but your qualifications align with our client organization's, we will retain your resume which will remain active in our candidate database for future opportunities.  Once we have a match, we will contact you!"
AgreedToMeet,Yes u can give me a call on Saturday afternoon for a small conversation
OutOfOffice,"I am OOTO, I'll response once i am back."
Deactivated,"Currently we are not looking for any hiring partner, but i will get in
touch if we need any help."
OutOfOffice,"I am currently out of office until 30 November, with limited access to email or voicemail. For anything urgent, please contact Matt Polston (matthew.polston@apellis.com)."
SeekingMoreInfo,"I feel written communication will be better. You can mail me your products with applications and corresponding benefits. At our plant we are dealing with oil lubricated systems with minerals oils (Servoprime-68, Servocycl C680 oils)."
OutOfOffice,"OUT OF OFFICE NOTICE: I am currently out of the office on vacation  with no access to email.  I will respond to your email when I return on Tuesday, July 7th."
SeekingMoreInfo,You may pls share the presentation or write up of your organisation.
SeekingMoreInfo,I would like to know the detailed services your company have regarding housing.
SeekingMoreInfo,Could you please let us know what assistance required from our end? So that we can proceed further.
OutOfOffice,I am away today and will respond to your email as soon as possible upon my return. Thank you.
OutOfOffice,I am currently on vacation and will have limited access to my email. Please give me a call or send me a text if urgent.
SeekingMoreInfo,Tnx for contacting me. I m almost local to Gurgoan with many relatives in real estate and contributing to local politics. I am residing in Rohtak. Let me know if you have interested tenant/buyer for 3 bhk at mapsko sector 82 Gurgoan
Deactivated,Thank you for your application.  If your details are suitable a consultant will be in contact to discuss your CV.
OutOfOffice,"Thank you for your email. I will be on annual leave returning to the office on Monday 11 January, 2021."
Deactivated,No meeting necessary.
Deactivated,Not Interested.
AgreedToMeet,"I believe you didn't receive my email - attached - , we can conduct a phone call tomorrow at 12:00 pm Cairo time , you can find my contacts undersigned below.
Will be waiting for your confirmation to schedule accordingly."
Deactivated,"I'm not interested in the position. I'm currently in a project delivery
role and wouldn't consider anything below that."
OutOfOffice,I will be on Annual leave till 21th March and will have limited access of mails and calls. Kindly communicate with leena Khaire in my absence
OutOfOffice,"Today I am out of the office. I will respond to your message after I return, please accept my apologies for any inconvenience."
OutOfOffice,I would be OOO this week on account of leave. Please expect delay and would revert once I resume office.
AgreedToMeet,"Ok Mr Rashesh.
By 11.30am would be better"
Deactivated,"we're not looking for any agency support at the moment, but if that changes I'll bear you in mind."
Unsubscribed,Please stop contacting me
OutOfOffice,"I will be out of the office until Monday, December 2. I will get back to you on Monday when I return. Thanks!"
SeekingMoreInfo,Let me known if you got a chance to go through it.
Deactivated,"thanks, but I don't have any needs at this time"
Deactivated,I won't need it as my property is already rented out.
Deactivated,No interest sorry
Deactivated,"However, this is to inform you that we have
already an agreement with Talent Corner HR Services for our hiring needs."
SeekingMoreInfo,"Hi and thanks for your enquiry to the team here at Humankind.
We wanted to let you know that we have received your email and one of our team will be in contact with you before the close of business tomorrow. If you've emailed over the weekend, we'll do our best to get back to you before the end of Monday."
OutOfOffice,"***OUT OF OFFICE***
I will be out of the office till Jan 4th, if something is urgent please reach out to my assistant Fabiola Pierre at fabiola@madebygather.com - otherwise I will get back to you when I return!"
SeekingMoreInfo,"I don't want to bother you, but I wanted to know if we could answer any questions you may have about us.
Can I help you set up a call to learn more?"
SeekingMoreInfo,"I don't want to bother you, but I'd like to see if we can answer any questions you have about us.
Would you be interested in setting up a call for more information?"
AgreedToMeet,Thanks Subhash. I have setup a meeting for 2pm tomorrow.
OutOfOffice,"I will be on vacation the week of September 7th returning to the office on Monday, September 14th."
Deactivated,"Please refrain from sending emails to alessio@ceradinigroup.com <mailto:alessio@ceradinigroup.com>  , that is NOT my email address.
Second thing, as I told you, IF my colleagues will be interested they will contact you back, I've already forwarded them your offer."
OutOfOffice,"I will be out of the office on 6/9/2020. If you have an immediate need, please contact me at 804.201.1605."
OutOfOffice,"I'm currently on vacation with limited access to email and voicemail.  I will respond to your email when I return to the office on Monday, September 21st.  Thank you."
Deactivated,"I don't want software, it would be helpful if you give marketing assistance means market for us."
SeekingMoreInfo,"As of now we are not looking into a new payroll
solution. But when we do. I'll shoot you an email."
Deactivated,"Thank you for your enquiry, which has been passed to the relevant individual or team.
We will aim to respond to you as soon as possible."
ConnectLater,We spoke on your offerings . As discussed I will discuss it internally and we can connect sometime in Dec and discuss again .
OutOfOffice,I am OOO and will be slow to respond to email. Please contact Ashley Watson (ashley@aclion.com<mailto:ashley@aclion.com>) or Alan Cutter (a.cutter@aclion.com<mailto:a.cutter@aclion.com>) in my absence. Thank you.
OutOfOffice,Thanks for your mail. I am out of office. Please expect delay in response.
Deactivated,currently we are under subscriptlon to Peony which has been providing very adequate service
Deactivated,"currently we have  no any requirement , in future if requirement will sure contact you."
OutOfOffice,"I will be out of the office Thursday, September 17th and Friday, September 18th.  Returning Monday, September 21st"
OutOfOffice,Thank you for writing . I am not in position to revert back .
AgreedToMeet,Yes please
Deactivated,"Given the Covid situation and as a precautionary measure, I am currently working from home."
OutOfOffice,"Currently i am out of office, in account of Customer Visit. I will be back to office on 18th Nov. Emails will be read and replied time to time."
OutOfOffice,I am currently out of the office until Monday 17th August 2020.
Deactivated,"Thanks for contact me for the opportunity as field service engineer.
As I am happy with my current employer and my role, i am not interested to change my job."
Deactivated,No thanks.  All set.  Sometimes you have to interpret the lack of reply as a reply.  Not feasible to answer all cold request nor good use of time.
Deactivated,"Since, I am a ""market maker"" in both scrap and semi metals I am not in the market for your services."
OutOfOffice,I am on vacation on Friday.
SeekingMoreInfo,"Can you please email me your solution at tphalke@deloitte.com.
Apologise in the delay for responding to you and Rahul."
Deactivated,Thanks for reaching out. Sorry we're not currently hiring for anyone like that.
OutOfOffice,I am currently on annual leave until Tuesday 19th October.
OutOfOffice,I will out of the office December 21st through January 1st.  I will be checking email during this time but please expect a delayed resonse.
Deactivated,Your support request (Case Number: 20909367) was received and will be answered in the order it was received.
Deactivated,We would get back to you in case there is a requirement.
SeekingMoreInfo,"Can we run the demo for Abhigyan today , Let us know if its possible ."
OutOfOffice,"I am currently out of the office and look forward to responding to your email on Monday, August 17."
Deactivated,I am not the intended recipient please.
SeekingMoreInfo,"Just wanted to know if you can arrange an online knowledge sharing session focussed on product /services and how basically you can help TATA steel for existing projects and plant operations.
Also would request if you can send a company brochure for us to go through."
SeekingMoreInfo,"The car body prices you referenced are dealer yard scale prices paid to irregular suppliers of scrap. Those are retail numbers.
Do you have a few minutes for a call?"
OutOfOffice,I am on leave on 31st August and 1st Sept is a holiday in India. Response to your emails will be delayed.
Deactivated,Currently all vendors empanelment is on hold.
SeekingMoreInfo,"We work only as a obtentor of the Sando Clementine protected Variety. We sold Patents.... But we are very Connected with exporters, producers etc... in Spain. If your proposals of sistems are in Spanich lenguage, you have options. Explain me more of your solutions."
SeekingMoreInfo,"Job sounds ok but I live in Chester now, I enclose my latest CV for your perusal in case you find similar in the NW."
Deactivated,"However, we do not see the need for any changes now.
In case of any requirement in the future, will get in touch with you."
SeekingMoreInfo,"I wanted to learn more about the deal that was advertised on instagram:
9.5k per night. Can you tell me more about it and the inclusions?"
OutOfOffice,"I am on PTO returning on Monday Nov 16, 2020 and may not be able to access emails."
Deactivated,I don't  need help at the moment sorry
Unsubscribed,"Why you are sending the same mail repeatedly.
Please stop to resend the same."
Deactivated,Not interested at this time.
Unsubscribed,Unsubscribe me please
OutOfOffice,"Thank you for your message. I will be away from the office on business travel Nov. 14-15.  If you need to reach me immediately, please call my cell: 408-981-6382."
